job_id,job_title,employer_name,employer_logo,employer_website,job_publisher,job_employment_type,job_employment_types,job_apply_link,job_apply_is_direct,apply_options,job_description,job_is_remote,job_posted_at,job_posted_at_timestamp,job_posted_at_datetime_utc,job_location,job_city,job_state,job_country,job_latitude,job_longitude,job_benefits,job_google_link,job_salary,job_min_salary,job_max_salary,job_salary_period,job_highlights,job_onet_soc,job_onet_job_zone
ok_JuNIFMMWW0XLQAAAAAA==,"Data Scientist, Product Analytics",Meta,https://encrypted-tbn0.gstatic.com/images?q=tbn:ANd9GcSrsPV50auya_P5N4t5W3jXXiFwdOQQhbhzNzhn&s=0,https://www.meta.com,Indeed,Full-time,['FULLTIME'],https://www.indeed.com/viewjob?jk=0be6e0cc0c2ba21f&utm_campaign=google_jobs_apply&utm_source=google_jobs_apply&utm_medium=organic,False,"[{'publisher': 'Indeed', 'apply_link': 'https://www.indeed.com/viewjob?jk=0be6e0cc0c2ba21f&utm_campaign=google_jobs_apply&utm_source=google_jobs_apply&utm_medium=organic', 'is_direct': False}, {'publisher': 'The Muse', 'apply_link': 'https://www.themuse.com/jobs/meta/data-scientist-product-analytics-be20d6?utm_campaign=google_jobs_apply&utm_source=google_jobs_apply&utm_medium=organic', 'is_direct': False}, {'publisher': 'ZipRecruiter', 'apply_link': 'https://www.ziprecruiter.com/c/Meta/Job/Data-Scientist,-Product-Analytics/-in-Washington,DC?jid=e78c399725fae7d0&utm_campaign=google_jobs_apply&utm_source=google_jobs_apply&utm_medium=organic', 'is_direct': False}, {'publisher': 'LinkedIn', 'apply_link': 'https://www.linkedin.com/jobs/view/data-scientist-product-analytics-at-meta-4120826323?utm_campaign=google_jobs_apply&utm_source=google_jobs_apply&utm_medium=organic', 'is_direct': False}, {'publisher': 'Jobs', 'apply_link': 'https://metacareers.dejobs.org/FA911B5BEC5B470A827BB85D51D3666325/?utm_campaign=google_jobs_apply&utm_source=google_jobs_apply&utm_medium=organic', 'is_direct': False}, {'publisher': 'Ladders', 'apply_link': 'https://www.theladders.com/job/data-scientist-product-analytics-meta-washington-dc_81617801?utm_campaign=google_jobs_apply&utm_source=google_jobs_apply&utm_medium=organic', 'is_direct': False}, {'publisher': 'National Labor Exchange', 'apply_link': 'https://usnlx.com/washington-dc/data-scientist-product-analytics/FA911B5BEC5B470A827BB85D51D36663/job/?vs=28&utm_campaign=google_jobs_apply&utm_source=google_jobs_apply&utm_medium=organic', 'is_direct': False}, {'publisher': 'JobGet', 'apply_link': 'https://www.jobget.com/jobs/job/4a87297b-a904-4ae6-bb11-e6dbf24abe0d?utm_campaign=google_jobs_apply&utm_source=google_jobs_apply&utm_medium=organic', 'is_direct': False}]","As a Data Scientist at Meta, you will shape the future of people-facing and business-facing products we build across our entire family of applications (Facebook, Instagram, Messenger, WhatsApp, Oculus). By applying your technical skills, analytical mindset, and product intuition to one of the richest data sets in the world, you will help define the experiences we build for billions of people and hundreds of millions of businesses around the world. You will collaborate on a wide array of product and business problems with a wide-range of cross-functional partners across Product, Engineering, Research, Data Engineering, Marketing, Sales, Finance and others. You will use data and analysis to identify and solve product development's biggest challenges. You will influence product strategy and investment decisions with data, be focused on impact, and collaborate with other teams. By joining Meta, you will become part of a world-class analytics community dedicated to skill development and career growth in analytics and beyond.Product leadership: You will use data to shape product development, quantify new opportunities, identify upcoming challenges, and ensure the products we build bring value to people, businesses, and Meta. You will help your partner teams prioritize what to build, set goals, and understand their product's ecosystem.Analytics: You will guide teams using data and insights. You will focus on developing hypotheses and employ a varied toolkit of rigorous analytical approaches, different methodologies, frameworks, and technical approaches to test them.Communication and influence: You won't simply present data, but tell data-driven stories. You will convince and influence your partners using clear insights and recommendations. You will build credibility through structure and clarity, and be a trusted strategic partner.

Data Scientist, Product Analytics Responsibilities:
• Work with large and complex data sets to solve a wide array of challenging problems using different analytical and statistical approaches
• Apply technical expertise with quantitative analysis, experimentation, data mining, and the presentation of data to develop strategies for our products that serve billions of people and hundreds of millions of businesses
• Identify and measure success of product efforts through goal setting, forecasting, and monitoring of key product metrics to understand trends
• Define, understand, and test opportunities and levers to improve the product, and drive roadmaps through your insights and recommendations
• Partner with Product, Engineering, and cross-functional teams to inform, influence, support, and execute product strategy and investment decisions

Minimum Qualifications:
• Bachelor's degree in Mathematics, Statistics, a relevant technical field, or equivalent
• 2+ years of work experience in analytics and data querying languages (e.g. SQL), scripting languages (e.g. Python), and/or statistical/mathematical software (e.g. R)
• 2+ years of experience solving analytical problems using quantitative approaches, understanding ecosystems, user behaviors & long-term product trends, and leading data-driven projects from definition to execution [including defining metrics, experiment, design, communicating actionable insights]

Preferred Qualifications:
• Master's or Ph.D. Degree in a quantitative field

About Meta:

Meta builds technologies that help people connect, find communities, and grow businesses. When Facebook launched in 2004, it changed the way people connect. Apps like Messenger, Instagram and WhatsApp further empowered billions around the world. Now, Meta is moving beyond 2D screens toward immersive experiences like augmented and virtual reality to help build the next evolution in social technology. People who choose to build their careers by building with us at Meta help shape a future that will take us beyond what digital connection makes possible today—beyond the constraints of screens, the limits of distance, and even the rules of physics.

Meta is proud to be an Equal Employment Opportunity and Affirmative Action employer. We do not discriminate based upon race, religion, color, national origin, sex (including pregnancy, childbirth, or related medical conditions), sexual orientation, gender, gender identity, gender expression, transgender status, sexual stereotypes, age, status as a protected veteran, status as an individual with a disability, or other applicable legally protected characteristics. We also consider qualified applicants with criminal histories, consistent with applicable federal, state and local law. Meta participates in the E-Verify program in certain locations, as required by law. Please note that Meta may leverage artificial intelligence and machine learning technologies in connection with applications for employment.

Meta is committed to providing reasonable accommodations for candidates with disabilities in our recruiting process. If you need any assistance or accommodations due to a disability, please let us know at accommodations-ext@fb.com.

$114,000/year to $171,000/year + bonus + equity + benefits

Individual compensation is determined by skills, qualifications, experience, and location. Compensation details listed in this posting reflect the base hourly rate, monthly rate, or annual salary only, and do not include bonus, equity or sales incentives, if applicable. In addition to base compensation, Meta offers benefits. Learn more about benefits at Meta.",False,,,,"Washington, DC",Washington,District of Columbia,US,38.9071923,-77.0368707,['health_insurance'],https://www.google.com/search?q=jobs&gl=us&hl=en&udm=8#vhid=vt%3D20/docid%3Dok_JuNIFMMWW0XLQAAAAAA%3D%3D&vssid=jobs-detail-viewer,,114000.0,171000.0,YEAR,"{'Qualifications': [""Bachelor's degree in Mathematics, Statistics, a relevant technical field, or equivalent"", '2+ years of work experience in analytics and data querying languages (e.g. SQL), scripting languages (e.g. Python), and/or statistical/mathematical software (e.g. R)', '2+ years of experience solving analytical problems using quantitative approaches, understanding ecosystems, user behaviors & long-term product trends, and leading data-driven projects from definition to execution [including defining metrics, experiment, design, communicating actionable insights]', 'Degree in a quantitative field', 'Meta participates in the E-Verify program in certain locations, as required by law'], 'Benefits': ['$114,000/year to $171,000/year + bonus + equity + benefits', 'Individual compensation is determined by skills, qualifications, experience, and location', 'Compensation details listed in this posting reflect the base hourly rate, monthly rate, or annual salary only, and do not include bonus, equity or sales incentives, if applicable', 'In addition to base compensation, Meta offers benefits'], 'Responsibilities': ['You will collaborate on a wide array of product and business problems with a wide-range of cross-functional partners across Product, Engineering, Research, Data Engineering, Marketing, Sales, Finance and others', ""You will use data and analysis to identify and solve product development's biggest challenges"", 'You will influence product strategy and investment decisions with data, be focused on impact, and collaborate with other teams', 'By joining Meta, you will become part of a world-class analytics community dedicated to skill development and career growth in analytics and beyond', 'Product leadership: You will use data to shape product development, quantify new opportunities, identify upcoming challenges, and ensure the products we build bring value to people, businesses, and Meta', ""You will help your partner teams prioritize what to build, set goals, and understand their product's ecosystem.Analytics: You will guide teams using data and insights"", 'You will focus on developing hypotheses and employ a varied toolkit of rigorous analytical approaches, different methodologies, frameworks, and technical approaches to test them', ""Communication and influence: You won't simply present data, but tell data-driven stories"", 'You will convince and influence your partners using clear insights and recommendations', 'You will build credibility through structure and clarity, and be a trusted strategic partner', 'Work with large and complex data sets to solve a wide array of challenging problems using different analytical and statistical approaches', 'Apply technical expertise with quantitative analysis, experimentation, data mining, and the presentation of data to develop strategies for our products that serve billions of people and hundreds of millions of businesses', 'Identify and measure success of product efforts through goal setting, forecasting, and monitoring of key product metrics to understand trends', 'Define, understand, and test opportunities and levers to improve the product, and drive roadmaps through your insights and recommendations', 'Partner with Product, Engineering, and cross-functional teams to inform, influence, support, and execute product strategy and investment decisions']}",15111100,5
fjQSD7VQvk098hJHAAAAAA==,Jr. Data Scientist (Hybrid),Piper Companies,,https://www.pipercompanies.com,Piper Companies,Full-time,['FULLTIME'],https://careers.pipercompanies.com/details/144247/jr_data_scientist_hybrid?utm_campaign=google_jobs_apply&utm_source=google_jobs_apply&utm_medium=organic,False,"[{'publisher': 'Piper Companies', 'apply_link': 'https://careers.pipercompanies.com/details/144247/jr_data_scientist_hybrid?utm_campaign=google_jobs_apply&utm_source=google_jobs_apply&utm_medium=organic', 'is_direct': False}, {'publisher': 'Dice', 'apply_link': 'https://www.dice.com/job-detail/7e050ac2-be92-4e31-b2d1-b53ec25695fd?utm_campaign=google_jobs_apply&utm_source=google_jobs_apply&utm_medium=organic', 'is_direct': False}, {'publisher': 'LinkedIn', 'apply_link': 'https://www.linkedin.com/jobs/view/jr-data-scientist-hybrid-at-piper-companies-4254150248?utm_campaign=google_jobs_apply&utm_source=google_jobs_apply&utm_medium=organic', 'is_direct': False}, {'publisher': 'Indeed', 'apply_link': 'https://www.indeed.com/viewjob?jk=bc313e775da7eabe&utm_campaign=google_jobs_apply&utm_source=google_jobs_apply&utm_medium=organic', 'is_direct': False}, {'publisher': 'Ladders', 'apply_link': 'https://www.theladders.com/job/jr-data-scientist-hybrid-pipercompanies-mclean-va_82017839?utm_campaign=google_jobs_apply&utm_source=google_jobs_apply&utm_medium=organic', 'is_direct': False}, {'publisher': 'Glassdoor', 'apply_link': 'https://www.glassdoor.com/job-listing/jr-data-scientist-hybrid-piper-companies-JV_IC1158535_KO0,24_KE25,40.htm?jl=1009786360498&utm_campaign=google_jobs_apply&utm_source=google_jobs_apply&utm_medium=organic', 'is_direct': False}, {'publisher': 'SimplyHired', 'apply_link': 'https://www.simplyhired.com/job/TI0PTDYd8vi5t4O1qaC76hg_lcxqhFax60Zb4w693mOP18eyAGJr5Q?utm_campaign=google_jobs_apply&utm_source=google_jobs_apply&utm_medium=organic', 'is_direct': False}, {'publisher': 'BeBee', 'apply_link': 'https://us.bebee.com/job/0c603d371d4bca82b8c29de86884f252?utm_campaign=google_jobs_apply&utm_source=google_jobs_apply&utm_medium=organic', 'is_direct': False}]","Piper Companies is seeking a Jr. Data Scientist to join one of the nation’s largest premier credit unions based out of Mclean,VA. The Jr. Data Scientist will implement quantitative models to analyze credit and prepayment risk, determine the allowance for loan losses, and support financial planning. This role is Hybrid (3 days on-site in Mclean, VA).

Responsibilities of the Jr. Data Scientist include:
• Implement models for loan loss allowance, CECL, stress testing, new volume origination, line of credit utilization, and prepayment models for all products, including credit card, personal loan, student loan, auto loan, mortgage, and commercial loan.
• Maintaining documentation for key processes and model components across the team with a focus on standardization of processes that satisfy model risk management, audit, and regulatory requirements.
• Implement vendor-developed models for consumer and commercial credit loss or prepayment.
• Monitor performance of quantitative models and support independent model validation efforts in accordance with the model risk management policy.
• Establish and document model implementation controls that satisfy model risk management, audit, and regulatory requirements.

Qualifications for the Jr. Data Scientist include:
• 3+ years of experience in quantitative modeling, development, or implementation.
• Working experience in data manipulation and advanced data analysis.
• Experience with SAS, R, Python, and proficiency working with large datasets is required.
• Applied experience with Logistic Regression, Linear Regression, Survival Analysis, Time Series Analysis, Decision Trees, and Cluster Analysis.
• Experience in at least one (1) of the following areas is preferred; real estate products, auto, credit card, student loan, or commercial loan.

Compensation for the Jr. Data Scientist include:
• Hourly Pay: $40 - $45/hr -- Salary Range: $90,000-$110,000 + Bonus Package
• Comprehensive Benefits: Medical, Dental, Vision, 401(k), PTO, Sick Leave (as required by law), and Holidays

This job opens for applications on 6/16/25. Applications will be accepted for at least 30 days from the posting date.

Keywords: #LI-MM1 #LI-HYBRID

Data, data science, R, sas, python, datasets, logistic regression, linear regression, survival analysis, time series analysis, decision trees, cluster analysis, real estate, auto, credit card, consumer lending, consumer banking, modeling, model implementation, model risk, documentation, prepayment risk, financial services,",False,3 days ago,1750377600.0,2025-06-20T00:00:00.000Z,"McLean, VA",McLean,Virginia,US,38.9338676,-77.1772604,"['health_insurance', 'dental_coverage', 'paid_time_off']",https://www.google.com/search?q=jobs&gl=us&hl=en&udm=8#vhid=vt%3D20/docid%3DfjQSD7VQvk098hJHAAAAAA%3D%3D&vssid=jobs-detail-viewer,,,,,"{'Qualifications': ['3+ years of experience in quantitative modeling, development, or implementation', 'Working experience in data manipulation and advanced data analysis', 'Experience with SAS, R, Python, and proficiency working with large datasets is required', 'Applied experience with Logistic Regression, Linear Regression, Survival Analysis, Time Series Analysis, Decision Trees, and Cluster Analysis'], 'Benefits': ['Compensation for the Jr', 'Hourly Pay: $40 - $45/hr -- Salary Range: $90,000-$110,000 + Bonus Package', 'Comprehensive Benefits: Medical, Dental, Vision, 401(k), PTO, Sick Leave (as required by law), and Holidays'], 'Responsibilities': ['Data Scientist will implement quantitative models to analyze credit and prepayment risk, determine the allowance for loan losses, and support financial planning', 'Implement models for loan loss allowance, CECL, stress testing, new volume origination, line of credit utilization, and prepayment models for all products, including credit card, personal loan, student loan, auto loan, mortgage, and commercial loan', 'Maintaining documentation for key processes and model components across the team with a focus on standardization of processes that satisfy model risk management, audit, and regulatory requirements', 'Implement vendor-developed models for consumer and commercial credit loss or prepayment', 'Monitor performance of quantitative models and support independent model validation efforts in accordance with the model risk management policy', 'Establish and document model implementation controls that satisfy model risk management, audit, and regulatory requirements']}",15111100,5
